target,x,y,d1,d2
überprüfen,Die Blutspendedienste überprüfen Ihre Blutwerte,Die Blutspendedienste überprüften Ihre Blutwerte,Die Blutspendedienste werden Ihre Blutwerte überprüfen,Die Blutspendedienste würden Ihre Blutwerte überprüfen
entfallen,Das Vorheizen des Ofens entfällt ebenfalls,Das Vorheizen des Ofens entfiel ebenfalls,Das Vorheizen des Ofens wird ebenfalls entfallen,Das Vorheizen des Ofens würde ebenfalls entfallen
vertreiben,Wir vertreiben diverse 3D Drucker,Wir vertrieben diverse 3D Drucker,Wir werden diverse 3D Drucker vertreiben,Wir würden diverse 3D Drucker vertreiben
übernehmen,Die Auswahl der Kinder übernehmen die Klassenleitungen,Die Auswahl der Kinder übernahmen die Klassenleitungen,Die Auswahl der Kinder werden die Klassenleitungen übernehmen,Die Auswahl der Kinder würden die Klassenleitungen übernehmen
brauchen,Der Deutsche Gehörlosen-Bund braucht starke Frauen,Der Deutsche Gehörlosen-Bund brauchte starke Frauen,Der Deutsche Gehörlosen-Bund wird starke Frauen brauchen,Der Deutsche Gehörlosen-Bund würde starke Frauen brauchen
konzentrieren,Die Designvision von KDE konzentriert sich auf zwei Attribute,Die Designvision von KDE konzentrierte sich auf zwei Attribute,Die Designvision von KDE wird sich auf zwei Attribute konzentrieren,Die Designvision von KDE würde sich auf zwei Attribute konzentrieren
klappen,Es klappt,Es klappte,Es wird klappen,Es würde klappen
einigen,Man einigt sich nicht,Man einigte sich nicht,Man wird sich nicht einigen,Man würde sich nicht einigen
können,Man kann eine Form Weiterlesen,Man konnte eine Form Weiterlesen,Man wird eine Form Weiterlesen können,Man würde eine Form Weiterlesen können
verbergen,Der südliche Teil der Tentudia verbirgt einige Überraschungen,Der südliche Teil der Tentudia verbarg einige Überraschungen,Der südliche Teil der Tentudia wird einige Überraschungen verbergen,Der südliche Teil der Tentudia würde einige Überraschungen verbergen
stammen,Die Wurstwaren stammen aus einer örtlichen Fleischerei,Die Wurstwaren stammten aus einer örtlichen Fleischerei,Die Wurstwaren werden aus einer örtlichen Fleischerei stammen,Die Wurstwaren würden aus einer örtlichen Fleischerei stammen
packen,Ich packe meine Einkäufe aus,Ich packte meine Einkäufe aus,Ich werde meine Einkäufe auspacken,Ich würde meine Einkäufe auspacken
schieben,Es schieben sich Eindrücke ineinander,Es schoben sich Eindrücke ineinander,Es werden sich Eindrücke ineinander schieben,Es würden sich Eindrücke ineinander schieben
laden,Die Sozial-Holding lädt alle Interessierten herzlich ein,Die Sozial-Holding lud alle Interessierten herzlich ein,Die Sozial-Holding wird alle Interessierten herzlich einladen,Die Sozial-Holding würde alle Interessierten herzlich einladen
fragen,Ein Freund von mir fragt danach,Ein Freund von mir fragte danach,Ein Freund von mir wird danach fragen,Ein Freund von mir würde danach fragen
springen,Ein weiterer Ex-Spieler springt ihm zur Seite,Ein weiterer Ex-Spieler sprang ihm zur Seite,Ein weiterer Ex-Spieler wird ihm zur Seite springen,Ein weiterer Ex-Spieler würde ihm zur Seite springen
äußern,Der Beschuldigte äußert sich nicht zu den Vorwürfen,Der Beschuldigte äußerte sich nicht zu den Vorwürfen,Der Beschuldigte wird sich nicht zu den Vorwürfen äußern,Der Beschuldigte würde sich nicht zu den Vorwürfen äußern
beinhalten,Die alte Rechtschreibordnung beinhaltet ebenso viel Un-Sinn,Die alte Rechtschreibordnung beinhaltete ebenso viel Un-Sinn,Die alte Rechtschreibordnung wird ebenso viel Un-Sinn beinhalten,Die alte Rechtschreibordnung würde ebenso viel Un-Sinn beinhalten
bearbeiten,Diese bearbeiten die Aufträge der Kunden,Diese bearbeiteten die Aufträge der Kunden,Diese werden die Aufträge der Kunden bearbeiten,Diese würden die Aufträge der Kunden bearbeiten
wählen,Jedes Land wählt nach einem eigenen Modus,Jedes Land wählte nach einem eigenen Modus,Jedes Land wird nach einem eigenen Modus wählen,Jedes Land würde nach einem eigenen Modus wählen
bewältigen,Ich bewältige Serpentine für Serpentine,Ich bewältigte Serpentine für Serpentine,Ich werde Serpentine für Serpentine bewältigen,Ich würde Serpentine für Serpentine bewältigen
erleiden,Ein Mensch erleidet einen Herzinfarkt,Ein Mensch erlitt einen Herzinfarkt,Ein Mensch wird einen Herzinfarkt erleiden,Ein Mensch würde einen Herzinfarkt erleiden
flüchten,Ein Fasan flüchtet unter einen Marquibusch,Ein Fasan flüchtete unter einen Marquibusch,Ein Fasan wird unter einen Marquibusch flüchten,Ein Fasan würde unter einen Marquibusch flüchten
entdecken,Ihr Sohn entdeckt die Tat,Ihr Sohn entdeckte die Tat,Ihr Sohn wird die Tat entdecken,Ihr Sohn würde die Tat entdecken
verbreiten,Die neue Kollektion La Perla verbreitet ein aristokratisches Flair,Die neue Kollektion La Perla verbreitete ein aristokratisches Flair,Die neue Kollektion La Perla wird ein aristokratisches Flair verbreiten,Die neue Kollektion La Perla würde ein aristokratisches Flair verbreiten
vereinbaren,Wir vereinbaren ein Treffen,Wir vereinbarten ein Treffen,Wir werden ein Treffen vereinbaren,Wir würden ein Treffen vereinbaren
bewundern,Ich bewundere dich,Ich bewunderte dich,Ich werde dich bewundern,Ich würde dich bewundern
gelangen,Sie gelangen nach Röpersdorf,Sie gelangten nach Röpersdorf,Sie werden nach Röpersdorf gelangen,Sie würden nach Röpersdorf gelangen
kontrollieren,Das Peak-Flowgerät kontrolliert den maximalen Atemfluß,Das Peak-Flowgerät kontrollierte den maximalen Atemfluß,Das Peak-Flowgerät wird den maximalen Atemfluß kontrollieren,Das Peak-Flowgerät würde den maximalen Atemfluß kontrollieren
fallen,Der Apfel fällt nicht weit vom Stamm,Der Apfel fiel nicht weit vom Stamm,Der Apfel wird nicht weit vom Stamm fallen,Der Apfel würde nicht weit vom Stamm fallen
überleben,Eine Lawine überlebt Oelz,Eine Lawine überlebte Oelz,Eine Lawine wird Oelz überleben,Eine Lawine würde Oelz überleben
gehen,Der Bericht geht weiter,Der Bericht ging weiter,Der Bericht wird weitergehen,Der Bericht würde weitergehen
befreien,Eine permanente Inventur befreit von den jährlichen Inventurgroßaktionen,Eine permanente Inventur befreite von den jährlichen Inventurgroßaktionen,Eine permanente Inventur wird von den jährlichen Inventurgroßaktionen befreien,Eine permanente Inventur würde von den jährlichen Inventurgroßaktionen befreien
überwachen,Der Paritätische Wohlfahrtsverband überwacht ebenfalls unsere Mittelverwendung,Der Paritätische Wohlfahrtsverband überwachte ebenfalls unsere Mittelverwendung,Der Paritätische Wohlfahrtsverband wird ebenfalls unsere Mittelverwendung überwachen,Der Paritätische Wohlfahrtsverband würde ebenfalls unsere Mittelverwendung überwachen
schauen,Es schaut sich erst mal um,Es schaute sich erst mal um,Es wird sich erst mal umschauen,Es würde sich erst mal umschauen
ordnen,Die Holznutzung ordnet sich diesen Zielen unter,Die Holznutzung ordnete sich diesen Zielen unter,Die Holznutzung wird sich diesen Zielen unterordnen,Die Holznutzung würde sich diesen Zielen unterordnen
finden,Unser beliebtes Familienfrühstück findet momentan leider nicht statt,Unser beliebtes Familienfrühstück fand momentan leider nicht statt,Unser beliebtes Familienfrühstück wird momentan leider nicht stattfinden,Unser beliebtes Familienfrühstück würde momentan leider nicht stattfinden
stehlen,Ein Lächeln stiehlt sich auf ihren Mund,Ein Lächeln stahl sich auf ihren Mund,Ein Lächeln wird sich auf ihren Mund stehlen,Ein Lächeln würde sich auf ihren Mund stehlen
sitzen,Das sitzt zwischen den Stühlen,Das saß zwischen den Stühlen,Das wird zwischen den Stühlen sitzen,Das würde zwischen den Stühlen sitzen
reißen,Der Erfolg im Schulhandball reißt nicht ab,Der Erfolg im Schulhandball riss nicht ab,Der Erfolg im Schulhandball wird nicht abreißen,Der Erfolg im Schulhandball würde nicht abreißen
ermöglichen,Die Röntgendiagnostik alleine ermöglicht häufig keine sichere Diagnose,Die Röntgendiagnostik alleine ermöglichte häufig keine sichere Diagnose,Die Röntgendiagnostik alleine wird häufig keine sichere Diagnose ermöglichen,Die Röntgendiagnostik alleine würde häufig keine sichere Diagnose ermöglichen
helfen,Unser Support hilft Dir dabei gerne weiter,Unser Support half Dir dabei gerne weiter,Unser Support wird Dir dabei gerne weiterhelfen,Unser Support würde Dir dabei gerne weiterhelfen
halten,Die einen halten ihre Produktentwicklung streng geheim,Die einen hielten ihre Produktentwicklung streng geheim,Die einen werden ihre Produktentwicklung streng geheim halten,Die einen würden ihre Produktentwicklung streng geheim halten
ziehen,Sie zieht relativ rasch ein,Sie zog relativ rasch ein,Sie wird relativ rasch einziehen,Sie würde relativ rasch einziehen
platzieren,Ein Kalkulationsschema platziert Zugriffsfolgen,Ein Kalkulationsschema platzierte Zugriffsfolgen,Ein Kalkulationsschema wird Zugriffsfolgen platzieren,Ein Kalkulationsschema würde Zugriffsfolgen platzieren
entschließen,Die selbsternannte Autorin entschließt sich zur Flucht,Die selbsternannte Autorin entschloss sich zur Flucht,Die selbsternannte Autorin wird sich zur Flucht entschließen,Die selbsternannte Autorin würde sich zur Flucht entschließen
schätzen,Ich schätze Alexandras Fotokunst sehr,Ich schätzte Alexandras Fotokunst sehr,Ich werde Alexandras Fotokunst sehr schätzen,Ich würde Alexandras Fotokunst sehr schätzen
belohnen,Wir belohnen dich mit Prämien,Wir belohnten dich mit Prämien,Wir werden dich mit Prämien belohnen,Wir würden dich mit Prämien belohnen
wecken,Sie wecken Entdeckerlust und Neugierde,Sie weckten Entdeckerlust und Neugierde,Sie werden Entdeckerlust und Neugierde wecken,Sie würden Entdeckerlust und Neugierde wecken
pflegen,Wir pflegen den fachlichen Gedankenaustausch,Wir pflegten den fachlichen Gedankenaustausch,Wir werden den fachlichen Gedankenaustausch pflegen,Wir würden den fachlichen Gedankenaustausch pflegen
verhalten,Alle anderen Bewohner der Voliere verhalten sich scheinbar gelöster,Alle anderen Bewohner der Voliere verhielten sich scheinbar gelöster,Alle anderen Bewohner der Voliere werden sich scheinbar gelöster verhalten,Alle anderen Bewohner der Voliere würden sich scheinbar gelöster verhalten
wollen,Ein Ostfriese will den Führerschein,Ein Ostfriese wollte den Führerschein,Ein Ostfriese wird den Führerschein wollen,Ein Ostfriese würde den Führerschein wollen
buchen,Wir buchen das Zimmer,Wir buchten das Zimmer,Wir werden das Zimmer buchen,Wir würden das Zimmer buchen
füttern,Ich füttere auf zwei Futterbrettern,Ich fütterte auf zwei Futterbrettern,Ich werde auf zwei Futterbrettern füttern,Ich würde auf zwei Futterbrettern füttern
verbrauchen,Die verbrauchen sich ja sehr schnell,Die verbrauchten sich ja sehr schnell,Die werden sich ja sehr schnell verbrauchen,Die würden sich ja sehr schnell verbrauchen
ahnen,Unsere vier Jungen ahnen noch nichts,Unsere vier Jungen ahnten noch nichts,Unsere vier Jungen werden noch nichts ahnen,Unsere vier Jungen würden noch nichts ahnen
nutzen,Unser Internetangebot nutzt sogenannte Cookies,Unser Internetangebot nutzte sogenannte Cookies,Unser Internetangebot wird sogenannte Cookies nutzen,Unser Internetangebot würde sogenannte Cookies nutzen
rollen,Die Rolle mit dem weißen Gold rollt,Die Rolle mit dem weißen Gold rollte,Die Rolle mit dem weißen Gold wird rollen,Die Rolle mit dem weißen Gold würde rollen
verbinden,Die beiden verbindet eine herzliche Antipathie,Die beiden verband eine herzliche Antipathie,Die beiden werden eine herzliche Antipathie verbinden,Die beiden würden eine herzliche Antipathie verbinden
kämpfen,Ich kämpfe für die Ewigkeit,Ich kämpfte für die Ewigkeit,Ich werde für die Ewigkeit kämpfen,Ich würde für die Ewigkeit kämpfen
etablieren,Ein neues Krankheitsbild PAS etabliert sich zusehends,Ein neues Krankheitsbild PAS etablierte sich zusehends,Ein neues Krankheitsbild PAS wird sich zusehends etablieren,Ein neues Krankheitsbild PAS würde sich zusehends etablieren
warten,Beide warten auf den Ersten,Beide warteten auf den Ersten,Beide werden auf den Ersten warten,Beide würden auf den Ersten warten
verankern,Sie verankern dadurch Ihr Ziel,Sie verankerten dadurch Ihr Ziel,Sie werden dadurch Ihr Ziel verankern,Sie würden dadurch Ihr Ziel verankern
bitten,Wir bitten um Entschuldigung,Wir baten um Entschuldigung,Wir werden um Entschuldigung bitten,Wir würden um Entschuldigung bitten
nutzen,Diese Webseite nutzt eine Verschlüsselung,Diese Webseite nutzte eine Verschlüsselung,Diese Webseite wird eine Verschlüsselung nutzen,Diese Webseite würde eine Verschlüsselung nutzen
behalten,Ein Mitarbeiter der Stadt behält die Sandsäcke im Auge,Ein Mitarbeiter der Stadt behielt die Sandsäcke im Auge,Ein Mitarbeiter der Stadt wird die Sandsäcke im Auge behalten,Ein Mitarbeiter der Stadt würde die Sandsäcke im Auge behalten
beginnen,Ein bis zwei Wochen später beginnen die typischen staccatoartigen Hustenanfälle,Ein bis zwei Wochen später begannen die typischen staccatoartigen Hustenanfälle,Ein bis zwei Wochen später werden die typischen staccatoartigen Hustenanfälle beginnen,Ein bis zwei Wochen später würden die typischen staccatoartigen Hustenanfälle beginnen
üben,Die Unterredungskunst zum Zwecke der Begriffsbestimmung übt SOKRATES aus,Die Unterredungskunst zum Zwecke der Begriffsbestimmung übte SOKRATES aus,Die Unterredungskunst zum Zwecke der Begriffsbestimmung wird SOKRATES ausüben,Die Unterredungskunst zum Zwecke der Begriffsbestimmung würde SOKRATES ausüben
beschleunigen,Dies beschleunigt den weltweiten Elektromobilitätsboom,Dies beschleunigte den weltweiten Elektromobilitätsboom,Dies wird den weltweiten Elektromobilitätsboom beschleunigen,Dies würde den weltweiten Elektromobilitätsboom beschleunigen
ansprechen,Eine kleine Geschichte die mich voll anspricht,Eine kleine Geschichte die mich voll ansprach,Eine kleine Geschichte die mich voll ansprechen wird,Eine kleine Geschichte die mich voll ansprechen würde
aufzeigen,Was auch folgendes Ranking aufzeigt,Was auch folgendes Ranking aufzeigte,Was auch folgendes Ranking aufzeigen wird,Was auch folgendes Ranking aufzeigen würde
betreten,Sie betreten den Vorraum der Halle,Sie betraten den Vorraum der Halle,Sie werden den Vorraum der Halle betreten,Sie würden den Vorraum der Halle betreten
entfalten,Es entfaltet sich eine neue Innovationskultur,Es entfaltete sich eine neue Innovationskultur,Es wird sich eine neue Innovationskultur entfalten,Es würde sich eine neue Innovationskultur entfalten
übersehen,Unser Bundesverkehrsminister übersieht in sträflicher Weise,Unser Bundesverkehrsminister übersah in sträflicher Weise,Unser Bundesverkehrsminister wird in sträflicher Weise übersehen,Unser Bundesverkehrsminister würde in sträflicher Weise übersehen
lernen,Sie lernen die Übungen des ZEN,Sie lernten die Übungen des ZEN,Sie werden die Übungen des ZEN lernen,Sie würden die Übungen des ZEN lernen
fliehen,Sie fliehen vom Zauberer,Sie flohen vom Zauberer,Sie werden vom Zauberer fliehen,Sie würden vom Zauberer fliehen
entfallen,Der restliche Mittelabruf entfällt auf die Messeförderung,Der restliche Mittelabruf entfiel auf die Messeförderung,Der restliche Mittelabruf wird auf die Messeförderung entfallen,Der restliche Mittelabruf würde auf die Messeförderung entfallen
betreffen,Die erste Neuerung betrifft die Filterdarstellung auf Schottenlandde,Die erste Neuerung betraf die Filterdarstellung auf Schottenlandde,Die erste Neuerung wird die Filterdarstellung auf Schottenlandde betreffen,Die erste Neuerung würde die Filterdarstellung auf Schottenlandde betreffen
unterhalten,Die ETG unterhält verschiedene Werke,Die ETG unterhielt verschiedene Werke,Die ETG wird verschiedene Werke unterhalten,Die ETG würde verschiedene Werke unterhalten
vorkommen,Was hier irgendwie oft vorkommt,Was hier irgendwie oft vorkam,Was hier irgendwie oft vorkommen wird,Was hier irgendwie oft vorkommen würde
brechen,Der Pilot bricht den Flug ab,Der Pilot brach den Flug ab,Der Pilot wird den Flug abbrechen,Der Pilot würde den Flug abbrechen
verdanken,Das heutige Thema verdankt sich einem gestrigen Besuch,Das heutige Thema verdankte sich einem gestrigen Besuch,Das heutige Thema wird sich einem gestrigen Besuch verdanken,Das heutige Thema würde sich einem gestrigen Besuch verdanken
legen,Die Finanzämter und auch die Finanzgerichte legen hier strenge Kriterien an,Die Finanzämter und auch die Finanzgerichte legten hier strenge Kriterien an,Die Finanzämter und auch die Finanzgerichte werden hier strenge Kriterien anlegen,Die Finanzämter und auch die Finanzgerichte würden hier strenge Kriterien anlegen
verhindern,Die verbesserte Lesefehlerkorrektur verhindert Brennabstürze,Die verbesserte Lesefehlerkorrektur verhinderte Brennabstürze,Die verbesserte Lesefehlerkorrektur wird Brennabstürze verhindern,Die verbesserte Lesefehlerkorrektur würde Brennabstürze verhindern
nachgehen,Wer ihr mit Hingabe und Leidenschaft nachgeht,Wer ihr mit Hingabe und Leidenschaft nachging,Wer ihr mit Hingabe und Leidenschaft nachgehen wird,Wer ihr mit Hingabe und Leidenschaft nachgehen würde
weiterhelfen,Was aber auch nicht weiterhilft,Was aber auch nicht weiterhalf,Was aber auch nicht weiterhelfen wird,Was aber auch nicht weiterhelfen würde
lösen,Wir lösen Ihre EDV-Probleme,Wir lösten Ihre EDV-Probleme,Wir werden Ihre EDV-Probleme lösen,Wir würden Ihre EDV-Probleme lösen
bestätigen,Die schlechte Form von Bertlich bestätigt sich auch heute,Die schlechte Form von Bertlich bestätigte sich auch heute,Die schlechte Form von Bertlich wird sich auch heute bestätigen,Die schlechte Form von Bertlich würde sich auch heute bestätigen
packen,Ein Mann packt aus,Ein Mann packte aus,Ein Mann wird auspacken,Ein Mann würde auspacken
töten,Der kleinere Brijesh tötet umgehend den Mörder,Der kleinere Brijesh tötete umgehend den Mörder,Der kleinere Brijesh wird umgehend den Mörder töten,Der kleinere Brijesh würde umgehend den Mörder töten
brennen,Es brennt nach einer Explosion,Es brannte nach einer Explosion,Es wird nach einer Explosion brennen,Es würde nach einer Explosion brennen
überschreiten,Die AfD-Chefin überschreitet eine moralische Grenze,Die AfD-Chefin überschritt eine moralische Grenze,Die AfD-Chefin wird eine moralische Grenze überschreiten,Die AfD-Chefin würde eine moralische Grenze überschreiten
berechnen,Die Gebühren berechnen sich nach dem Gegenstandswert,Die Gebühren berechneten sich nach dem Gegenstandswert,Die Gebühren werden sich nach dem Gegenstandswert berechnen,Die Gebühren würden sich nach dem Gegenstandswert berechnen
realisieren,Wir realisieren auch Ihre Sonderwünsche,Wir realisierten auch Ihre Sonderwünsche,Wir werden auch Ihre Sonderwünsche realisieren,Wir würden auch Ihre Sonderwünsche realisieren
versprechen,Der Bund verspricht nun Unterstützung und Geld,Der Bund versprach nun Unterstützung und Geld,Der Bund wird nun Unterstützung und Geld versprechen,Der Bund würde nun Unterstützung und Geld versprechen
kleben,Die Gummies kleben fast am Gerät,Die Gummies klebten fast am Gerät,Die Gummies werden fast am Gerät kleben,Die Gummies würden fast am Gerät kleben
erklären,Wir erklären Ihnen diese im Anschluss,Wir erklärten Ihnen diese im Anschluss,Wir werden Ihnen diese im Anschluss erklären,Wir würden Ihnen diese im Anschluss erklären
verwenden,Unsere Website verwendet sogenannte Cookies,Unsere Website verwendete sogenannte Cookies,Unsere Website wird sogenannte Cookies verwenden,Unsere Website würde sogenannte Cookies verwenden
reichen,Es reicht ein einzelner Karton,Es reichte ein einzelner Karton,Es wird ein einzelner Karton reichen,Es würde ein einzelner Karton reichen
klingen,Es klingt anders,Es klang anders,Es wird anders klingen,Es würde anders klingen
verschieben,Die Zielzeichen und Zielimpulse verschieben sich ruckartig,Die Zielzeichen und Zielimpulse verschoben sich ruckartig,Die Zielzeichen und Zielimpulse werden sich ruckartig verschieben,Die Zielzeichen und Zielimpulse würden sich ruckartig verschieben
tauchen,Manche Kinder tauchen nach Muscheln und Krebsen,Manche Kinder tauchten nach Muscheln und Krebsen,Manche Kinder werden nach Muscheln und Krebsen tauchen,Manche Kinder würden nach Muscheln und Krebsen tauchen
veranstalten,Der Leibniz-Forschungsverbund Bildungspotenziale veranstaltet jährlich ein Bildungspolitisches Forum,Der Leibniz-Forschungsverbund Bildungspotenziale veranstaltete jährlich ein Bildungspolitisches Forum,Der Leibniz-Forschungsverbund Bildungspotenziale wird jährlich ein Bildungspolitisches Forum veranstalten,Der Leibniz-Forschungsverbund Bildungspotenziale würde jährlich ein Bildungspolitisches Forum veranstalten
offenbaren,Die Eidgenossen offenbaren spielerische Vorteile,Die Eidgenossen offenbarten spielerische Vorteile,Die Eidgenossen werden spielerische Vorteile offenbaren,Die Eidgenossen würden spielerische Vorteile offenbaren
spiegeln,Sein ausgeprägtes Geltungsbedürfnis spiegelt sein geringes Selbstwertgefühl,Sein ausgeprägtes Geltungsbedürfnis spiegelte sein geringes Selbstwertgefühl,Sein ausgeprägtes Geltungsbedürfnis wird sein geringes Selbstwertgefühl spiegeln,Sein ausgeprägtes Geltungsbedürfnis würde sein geringes Selbstwertgefühl spiegeln
erlernen,Sie erlernen Themenübersicht,Sie erlernten Themenübersicht,Sie werden Themenübersicht erlernen,Sie würden Themenübersicht erlernen
spezialisieren,Sie spezialisieren sich auf die Lücke,Sie spezialisierten sich auf die Lücke,Sie werden sich auf die Lücke spezialisieren,Sie würden sich auf die Lücke spezialisieren
geraten,Die nuklearen Arsenale geraten außer Kontrolle,Die nuklearen Arsenale gerieten außer Kontrolle,Die nuklearen Arsenale werden außer Kontrolle geraten,Die nuklearen Arsenale würden außer Kontrolle geraten
zerstören,Wer zerstört was?,Wer zerstörte was?,Wer wird was zerstören?,Wer würde was zerstören?
hängen,Die Zweige hängen häufig,Die Zweige hingen häufig,Die Zweige werden häufig hängen,Die Zweige würden häufig hängen
helfen,Kein Problem wir helfen Ihnen weiter,Kein Problem wir halfen Ihnen weiter,Kein Problem wir werden Ihnen weiterhelfen,Kein Problem wir würden Ihnen weiterhelfen
stellen,Wir stellen uns vor,Wir stellten uns vor,Wir werden uns vorstellen,Wir würden uns vorstellen
brennen,Der Irak brennt wieder,Der Irak brannte wieder,Der Irak wird wieder brennen,Der Irak würde wieder brennen
schließen,Die Komplet schließt den Tag ab,Die Komplet schloss den Tag ab,Die Komplet wird den Tag abschließen,Die Komplet würde den Tag abschließen
hassen,Ich hasse Oasis,Ich hasste Oasis,Ich werde Oasis hassen,Ich würde Oasis hassen
gehen,Es geht auch anders,Es ging auch anders,Es wird auch anders gehen,Es würde auch anders gehen
identifizieren,Wir identifizieren mehrere,Wir identifizierten mehrere,Wir werden mehrere identifizieren,Wir würden mehrere identifizieren
testen,Wir testen Produkte und mehr,Wir testeten Produkte und mehr,Wir werden Produkte und mehr testen,Wir würden Produkte und mehr testen
stärken,Seine Beeren stärken Ihr Immunsystem,Seine Beeren stärkten Ihr Immunsystem,Seine Beeren werden Ihr Immunsystem stärken,Seine Beeren würden Ihr Immunsystem stärken
beleuchten,Die 60-seitige Broschüre beleuchtet Defizite in der Bearbeit,Die 60-seitige Broschüre beleuchtete Defizite in der Bearbeit,Die 60-seitige Broschüre wird Defizite in der Bearbeit beleuchten,Die 60-seitige Broschüre würde Defizite in der Bearbeit beleuchten
liegen,Eine der besuchenswertesten Höhlen Europas liegt im Süden Belgiens,Eine der besuchenswertesten Höhlen Europas lag im Süden Belgiens,Eine der besuchenswertesten Höhlen Europas wird im Süden Belgiens liegen,Eine der besuchenswertesten Höhlen Europas würde im Süden Belgiens liegen
unterrichten,Der Primarlehrer Markus Busin unterrichtet in Zürich,Der Primarlehrer Markus Busin unterrichtete in Zürich,Der Primarlehrer Markus Busin wird in Zürich unterrichten,Der Primarlehrer Markus Busin würde in Zürich unterrichten
hinterlassen,Eine Adoption hinterlässt Wunden,Eine Adoption hinterließ Wunden,Eine Adoption wird Wunden hinterlassen,Eine Adoption würde Wunden hinterlassen
erwischen,Wir erwischen Michael Paris zu Hause,Wir erwischten Michael Paris zu Hause,Wir werden Michael Paris zu Hause erwischen,Wir würden Michael Paris zu Hause erwischen
gelten,Die Regeln gelten für das Vereinsgelände,Die Regeln galten für das Vereinsgelände,Die Regeln werden für das Vereinsgelände gelten,Die Regeln würden für das Vereinsgelände gelten
erleichtern,Ein Kugelkopf erleichtert die Stativhandhabung immens,Ein Kugelkopf erleichterte die Stativhandhabung immens,Ein Kugelkopf wird die Stativhandhabung immens erleichtern,Ein Kugelkopf würde die Stativhandhabung immens erleichtern
stehlen,Wer stiehlt schon Unterschenkel?,Wer stahl schon Unterschenkel?,Wer wird schon Unterschenkel stehlen?,Wer würde schon Unterschenkel stehlen?
setzen,Wer setzt sich dann durch?,Wer setzte sich dann durch?,Wer wird sich dann durchsetzen?,Wer würde sich dann durchsetzen?
ignorieren,Das Regime in Kosova ignoriert die Diaspora,Das Regime in Kosova ignorierte die Diaspora,Das Regime in Kosova wird die Diaspora ignorieren,Das Regime in Kosova würde die Diaspora ignorieren
vermögen,Ich vermag es nicht,Ich vermochte es nicht,Ich werde es nicht vermögen,Ich würde es nicht vermögen
machen,Das macht der PIC nebenbei,Das machte der PIC nebenbei,Das wird der PIC nebenbei machen,Das würde der PIC nebenbei machen
probieren,Ich probieren gern neue Rezepte aus,Ich probierte gern neue Rezepte aus,Ich werde gern neue Rezepte ausprobieren,Ich würde gern neue Rezepte ausprobieren
