target,x,y,d1,d2
erobern,Die Italiener erobern Tripolis,Die Italiener eroberten Tripolis,Die Italiener werden Tripolis eroberten,Die Italiener würden Tripolis erobern
riechen,Es riecht nach feuchter Erde,Es roch nach feuchter Erde,Es wird nach feuchter Erde riechen,Es würde nach feuchter Erde riechen
vollziehen,Der Wandel vollzieht sich stetig,Der Wandel vollzog sich stetig,Der Wandel wird sich stetig vollziehen,Der Wandel würde sich stetig vollziehen
verlängern,Das verlängert die Akku-Laufzeit,Das verlängerte die Akku-Laufzeit,Das wird die Akku-Laufzeit verlängern,Das würde die Akku-Laufzeit verlängern
werfen,Der Trainer wirft kurze Bälle hinters Netz,Der Trainer warf kurze Bälle hinters Netz,Der Trainer wird kurze Bälle hinters Netz werfen,Der Trainer würde kurze Bälle hinters Netz werfen
finanzieren,Sie finanzieren die organisierte Kriminalität,Sie finanzierten die organisierte Kriminalität,Sie werden die organisierte Kriminalität finanzieren,Sie würden die organisierte Kriminalität finanzieren
gestatten,Das gestattet ihnen einen luxuriösen Lebensstil,Das gestattete ihnen einen luxuriösen Lebensstil,Das wird ihnen einen luxuriösen Lebensstil gestatten,Das würde ihnen einen luxuriösen Lebensstil gestatten
konzentrieren,Die LOGPR-Spezialisten konzentrieren sich auf die Logistik-Branche,Die LOGPR-Spezialisten konzentrierten sich auf die Logistik-Branche,Die LOGPR-Spezialisten werden sich auf die Logistik-Branche konzentrieren,Die LOGPR-Spezialisten würden sich auf die Logistik-Branche konzentrieren
rutschen,Ich rutsche mit dem Untergrund zurück,Ich rutschte mit dem Untergrund zurück,Ich werde mit dem Untergrund zurückrutschen,Ich würde mit dem Untergrund zurückrutschen
schaffen,Wir schaffen Freiraum,Wir schufen Freiraum,Wir werden Freiraum schaffen,Wir würden Freiraum schaffen
erscheinen,Es erscheinen nun Rechts kleine Icons,Es erschienen nun Rechts kleine Icons,Es werden nun Rechts kleine Icons erscheinen,Es würden nun Rechts kleine Icons erscheinen
rühren,Nichts rührt sich ohne dich,Nichts rührte sich ohne dich,Nichts wird sich ohne dich rühren,Nichts würde sich ohne dich rühren
zeigen,Wir zeigen mehr,Wir zeigten mehr,Wir werden mehr zeigen,Wir würden mehr zeigen
drängen,Die Shannon Star drängt sich auf,Die Shannon Star drängte sich auf,Die Shannon Star wird sich aufdrängen,Die Shannon Star würde sich aufdrängen
kündigen,Ein wunderschöner kalter Wintertag kündigt sich an,Ein wunderschöner kalter Wintertag kündigte sich an,Ein wunderschöner kalter Wintertag wird sich ankündigen,Ein wunderschöner kalter Wintertag würde sich ankündigen
berufen,Der Veranstalter des Vienna City Marathon beruft sich auf seine Teilnahmebedingungen,Der Veranstalter des Vienna City Marathon berief sich auf seine Teilnahmebedingungen,Der Veranstalter des Vienna City Marathon wird sich auf seine Teilnahmebedingungen berufen,Der Veranstalter des Vienna City Marathon würde sich auf seine Teilnahmebedingungen berufen
tagen,Alle diese Gremien tagen öffentlich,Alle diese Gremien tagten öffentlich,Alle diese Gremien werden öffentlich tagen,Alle diese Gremien würden öffentlich tagen
bestreiten,Die beiden Animationsmannschaften U13 bestreiten Mehrfrontenturniere,Die beiden Animationsmannschaften U13 bestritten Mehrfrontenturniere,Die beiden Animationsmannschaften U13 werden Mehrfrontenturniere bestreiten,Die beiden Animationsmannschaften U13 würden Mehrfrontenturniere bestreiten
hassen,Wir hassen die Scheisskoyoten,Wir hassten die Scheisskoyoten,Wir werden die Scheisskoyoten hassen,Wir würden die Scheisskoyoten hassen
reparieren,Das Auto-Vorbeck-Serviceteam repariert alle Fahrzeuge,Das Auto-Vorbeck-Serviceteam reparierte alle Fahrzeuge,Das Auto-Vorbeck-Serviceteam wird alle Fahrzeuge reparieren,Das Auto-Vorbeck-Serviceteam würde alle Fahrzeuge reparieren
variieren,Die Länge der Nadeln variiert je nach Einsatzbereich,Die Länge der Nadeln variierte je nach Einsatzbereich,Die Länge der Nadeln wird je nach Einsatzbereich variieren,Die Länge der Nadeln würde je nach Einsatzbereich variieren
umgeben,Die Marke umgibt eine besondere Aura,Die Marke umgab eine besondere Aura,Die Marke wird eine besondere Aura umgeben,Die Marke würde eine besondere Aura umgeben
behaupten,Die deutschen Milchproduzenten behaupten das Mittelfeld,Die deutschen Milchproduzenten behaupteten das Mittelfeld,Die deutschen Milchproduzenten werden das Mittelfeld behaupten,Die deutschen Milchproduzenten würden das Mittelfeld behaupten
vermissen,Ich vermisse das ganz schön,Ich vermisste das ganz schön,Ich werde das ganz schön vermissen,Ich würde das ganz schön vermissen
heiraten,Sie heiratet,Sie heiratete,Sie wird heiraten,Sie würde heiraten
absolvieren,Ich absolviere dich,Ich absolvierte dich,Ich werde dich absolvieren,Ich würde dich absolvieren
vereinbaren,Das vereinbart beide Vorteile,Das vereinbarte beide Vorteile,Das wird beide Vorteile vereinbaren,Das würde beide Vorteile vereinbaren
entspannen,Der Duft entspannt sofort,Der Duft entspannte sofort,Der Duft wird sofort entspannen,Der Duft würde sofort entspannen
spezialisieren,Die meisten Verkäufer Kairos spezialisieren sich auf bestimmte Verkaufsartikel,Die meisten Verkäufer Kairos spezialisierten sich auf bestimmte Verkaufsartikel,Die meisten Verkäufer Kairos werden sich auf bestimmte Verkaufsartikel spezialisieren,Die meisten Verkäufer Kairos würden sich auf bestimmte Verkaufsartikel spezialisieren
raten,Der Bundesrat und das Parlament raten zur Ablehnung der Mindestlohn-Initiative,Der Bundesrat und das Parlament rieten zur Ablehnung der Mindestlohn-Initiative,Der Bundesrat und das Parlament werden zur Ablehnung der Mindestlohn-Initiative raten,Der Bundesrat und das Parlament würden zur Ablehnung der Mindestlohn-Initiative raten
steuern,der Planende steuert maßgeblich den Planungsprozess,der Planende steuerte maßgeblich den Planungsprozess,der Planende wird maßgeblich den Planungsprozess steuern,der Planende würde maßgeblich den Planungsprozess steuern
bewirken,Sie bewirken die Leistungen ihrer Teams,Sie bewirkten die Leistungen ihrer Teams,Sie werden die Leistungen ihrer Teams bewirken,Sie würden die Leistungen ihrer Teams bewirken
nähern,Die lange angekündigte Corona-Warn-App nähert sich offenbar der Fertigstellung,Die lange angekündigte Corona-Warn-App näherte sich offenbar der Fertigstellung,Die lange angekündigte Corona-Warn-App wird sich offenbar der Fertigstellung nähern,Die lange angekündigte Corona-Warn-App würde sich offenbar der Fertigstellung nähern
bereiten,Sie bereiten,Sie bereiteten,Sie werden bereiten,Sie würden bereiten
wagen,Wer wagt den ersten Schritt?,Wer wagte den ersten Schritt?,Wer wird den ersten Schritt wagen?,Wer würde den ersten Schritt wagen?
feiern,Die Leute feiern,Die Leute feierten,Die Leute werden feiern,Die Leute würden feiern
generieren,Eine separate 4-Chip-LED generiert das Abbiegelicht,Eine separate 4-Chip-LED generierte das Abbiegelicht,Eine separate 4-Chip-LED wird das Abbiegelicht generieren,Eine separate 4-Chip-LED würde das Abbiegelicht generieren
stoßen,Der Wunsch stößt sich an der Realität,Der Wunsch stieß sich an der Realität,Der Wunsch wird sich an der Realität stoßen,Der Wunsch würde sich an der Realität stoßen
erstellen,Wir erstellen Ihr individuelles Ergebnis,Wir erstellten Ihr individuelles Ergebnis,Wir werden Ihr individuelles Ergebnis erstellen,Wir würden Ihr individuelles Ergebnis erstellen
zahlen,Die Ermittler zahlen eine hohe Belohnung,Die Ermittler zahlten eine hohe Belohnung,Die Ermittler werden eine hohe Belohnung zahlen,Die Ermittler würden eine hohe Belohnung zahlen
passen,Welche Grundierung passt zu meinem Hautton?,Welche Grundierung passte zu meinem Hautton?,Welche Grundierung wird zu meinem Hautton passen?,Welche Grundierung würde zu meinem Hautton passen?
nützen,Es nützt dir und dem anderen,Es nützte dir und dem anderen,Es wird dir und dem anderen nützen,Es würde dir und dem anderen nützen
betreffen,Es betrifft nur Jungen,Es betraf nur Jungen,Es wird nur Jungen betreffen,Es würde nur Jungen betreffen
regeln,Alles andere regelt sich dann schon,Alles andere regelte sich dann schon,Alles andere wird sich dann schon regeln,Alles andere würde sich dann schon regeln
entscheiden,Der kleinste gemeinsame Nenner entscheidet da,Der kleinste gemeinsame Nenner entschied da,Der kleinste gemeinsame Nenner wird da entscheiden,Der kleinste gemeinsame Nenner würde da entscheiden
enden,Die Bewerbungsfrist endet bereits am 18 April 2017,Die Bewerbungsfrist endete bereits am 18. April 2017,Die Bewerbungsfrist wird bereits am 18. April 2017 enden,Die Bewerbungsfrist würde bereits am 18. April 2017 enden
leiten,Er leitet die deutsche Delegation,Er leitete die deutsche Delegation,Er wird die deutsche Delegation leiten,Er würde die deutsche Delegation leiten
ordnen,Wer ordnet diese Folgen und wie?,Wer ordnete diese Folgen und wie?,Wer wird diese Folgen ordnen und wie?,Wer würde diese Folgen ordnen und wie?
behandeln,Der behandelt generelle Videospielgeschichte,Der behandelte generelle Videospielgeschichte,Der wird generelle Videospielgeschichte behandeln,Der würde generelle Videospielgeschichte behandeln
verbreiten,Das nostalgische Cover verbreitet eine heitere Stimmung,Das nostalgische Cover verbreitete eine heitere Stimmung,Das nostalgische Cover wird eine heitere Stimmung verbreiten,Das nostalgische Cover würde eine heitere Stimmung verbreiten
kennenlernen,Die Mannschaft kennenlernen,Die Mannschaft kennenlernte,Die Mannschaft wird kennenlernen,Die Mannschaft würde kennenlernen
demonstrieren,Eine Vergleichsrechnung demonstriert dies deutlich,Eine Vergleichsrechnung demonstrierte dies deutlich,Eine Vergleichsrechnung wird dies deutlich demonstrieren,Eine Vergleichsrechnung würde dies deutlich demonstrieren
erfüllen,Das Stadtarchiv erfüllt eine wichtige Aufgabe,Das Stadtarchiv erfüllte eine wichtige Aufgabe,Das Stadtarchiv wird eine wichtige Aufgabe erfüllen,Das Stadtarchiv würde eine wichtige Aufgabe erfüllen
feiern,Der Verein feiert mittlerweile sein 10-jähriges Jubiläum,Der Verein feierte mittlerweile sein 10-jähriges Jubiläum,Der Verein wird mittlerweile sein 10-jähriges Jubiläum feiern,Der Verein würde mittlerweile sein 10-jähriges Jubiläum feiern
wünschen,Wir wünschen Ihnen eine gute Anreise,Wir wünschten Ihnen eine gute Anreise,Wir werden Ihnen eine gute Anreise wünschen,Wir würden Ihnen eine gute Anreise wünschen
reißen,Es reißt ihnen das Herz heraus,Es riss ihnen das Herz heraus,Es wird ihnen das Herz herausreißen,Es würde ihnen das Herz herausreißen
ehren,Wir ehren sein Andenken,Wir ehrten sein Andenken,Wir werden sein Andenken ehren,Wir würden sein Andenken ehren
erfinden,Der Potsdamer Moritz Hermann Jacobi erfindet den Elektromotor,Der Potsdamer Moritz Hermann Jacobi erfand den Elektromotor,Der Potsdamer Moritz Hermann Jacobi wird den Elektromotor erfinden,Der Potsdamer Moritz Hermann Jacobi würde den Elektromotor erfinden
zerstören,Der Präsident zerstört das Fundament der amerikanischen Gesellschaft,Der Präsident zerstörte das Fundament der amerikanischen Gesellschaft,Der Präsident wird das Fundament der amerikanischen Gesellschaft zerstören,Der Präsident würde das Fundament der amerikanischen Gesellschaft zerstören
fertigen,Wir fertigen keine Leinwand-Bausätze,Wir fertigten keine Leinwand-Bausätze,Wir werden keine Leinwand-Bausätze fertigen,Wir würden keine Leinwand-Bausätze fertigen
glauben,Ich glaube an das Pferd,Ich glaubte an das Pferd,Ich werde an das Pferd glauben,Ich würde an das Pferd glauben
feiern,Wir feiern heute Chorjubiläum und Kirchweih,Wir feierten heute Chorjubiläum und Kirchweih,Wir werden heute Chorjubiläum und Kirchweih feiern,Wir würden heute Chorjubiläum und Kirchweih feiern
etablieren,Die Präsenz der Frauen etabliert dafür das theatralische Spannungsfeld,Die Präsenz der Frauen etablierte dafür das theatralische Spannungsfeld,Die Präsenz der Frauen wird dafür das theatralische Spannungsfeld etablieren,Die Präsenz der Frauen würde dafür das theatralische Spannungsfeld etablieren
registrieren,Man registriert sich,Man registrierte sich,Man wird sich registrieren,Man würde sich registrieren
vermeiden,Die einheitliche Pflege im zentralen System vermeidet Datenredundanz,Die einheitliche Pflege im zentralen System vermied Datenredundanz,Die einheitliche Pflege im zentralen System wird Datenredundanz vermeiden,Die einheitliche Pflege im zentralen System würde Datenredundanz vermeiden
mitmachen,Alle Kinder mitmachen,Alle Kinder machten mit,Alle Kinder werden mitmachen,Alle Kinder würden mitmachen
teilen,Wir teilen diese Auffassung nicht,Wir teilten diese Auffassung nicht,Wir werden diese Auffassung nicht teilen,Wir würden diese Auffassung nicht teilen
erhalten,Ich erhalte dauernd ungewollte Private Nachrichten,Ich erhielt dauernd ungewollte Private Nachrichten,Ich werde dauernd ungewollte Private Nachrichten erhalten,Ich würde dauernd ungewollte Private Nachrichten erhalten
lenken,Man lenkt sich also ab,Man lenkte sich also ab,Man wird sich also ablenken,Man würde sich also ablenken
stürzen,Die Welt stürzt in den Ersten Weltkrieg,Die Welt stürzte in den Ersten Weltkrieg,Die Welt wird in den Ersten Weltkrieg stürzen,Die Welt würde in den Ersten Weltkrieg stürzen
beruhen,Jedes Fundament beruht auf Gott,Jedes Fundament beruhte auf Gott,Jedes Fundament wird auf Gott beruhen,Jedes Fundament würde auf Gott beruhen
holen,Wir holen sie ab,Wir holten sie ab,Wir werden sie abholen,Wir würden sie abholen
vertrauen,Ich vertraue ihr,Ich vertraute ihr,Ich werde ihr vertrauen,Ich würde ihr vertrauen
bestimmen,Die Spielregeln im Job bestimmen immer noch sie,Die Spielregeln im Job bestimmten immer noch sie,Die Spielregeln im Job werden immer noch sie bestimmen,Die Spielregeln im Job würden immer noch sie bestimmen
erschaffen,Die Technologie erschafft Lebensgrundlagen,Die Technologie erschuf Lebensgrundlagen,Die Technologie wird Lebensgrundlagen erschaffen,Die Technologie würde Lebensgrundlagen erschaffen
arbeiten,Der Blower arbeitet wie eine Luftpumpe,Der Blower arbeitete wie eine Luftpumpe,Der Blower wird wie eine Luftpumpe arbeiten,Der Blower würde wie eine Luftpumpe arbeiten
treiben,Man treibt sie durch ein Sieb,Man trieb sie durch ein Sieb,Man wird sie durch ein Sieb treiben,Man würde sie durch ein Sieb treiben
stecken,Welcher Anbieter steckt hinter Eazy?,Welcher Anbieter steckte hinter Eazy?,Welcher Anbieter wird hinter Eazy stecken?,Welcher Anbieter würde hinter Eazy stecken?
ermöglichen,Die nicht-amtlichen Stimmzettel ermöglichen einiges an Wahlbetrugspotenzial,Die nicht-amtlichen Stimmzettel ermöglichten einiges an Wahlbetrugspotenzial,Die nicht-amtlichen Stimmzettel werden einiges an Wahlbetrugspotenzial ermöglichen,Die nicht-amtlichen Stimmzettel würden einiges an Wahlbetrugspotenzial ermöglichen
flüchten,Die Ortsbewohner flüchten in den Tiergarten,Die Ortsbewohner flüchteten in den Tiergarten,Die Ortsbewohner werden in den Tiergarten flüchten,Die Ortsbewohner würden in den Tiergarten flüchten
gestalten,Die Wahl der Farbe gestaltet die Carportplanung besonders hilfreich,Die Wahl der Farbe gestaltete die Carportplanung besonders hilfreich,Die Wahl der Farbe wird die Carportplanung besonders hilfreich gestalten,Die Wahl der Farbe würde die Carportplanung besonders hilfreich gestalten
vermögen,Ein Mutterherz vermag viel,Ein Mutterherz vermochte viel,Ein Mutterherz wird viel vermögen,Ein Mutterherz würde viel vermögen
erhalten,Sie erhalten eine Teilnehmerstation,Sie erhielten eine Teilnehmerstation,Sie werden eine Teilnehmerstation erhalten,Sie würden eine Teilnehmerstation erhalten
steigen,Der alte Mann steigt in den Springbrunnen,Der alte Mann stieg in den Springbrunnen,Der alte Mann wird in den Springbrunnen steigen,Der alte Mann würde in den Springbrunnen steigen
vereinbaren,Die Bundesrepublik und die Sowjetunion vereinbaren die Einrichtung von Touristik-Büros,Die Bundesrepublik und die Sowjetunion vereinbarten die Einrichtung von Touristik-Büros,Die Bundesrepublik und die Sowjetunion werden die Einrichtung von Touristik-Büros vereinbaren,Die Bundesrepublik und die Sowjetunion würden die Einrichtung von Touristik-Büros vereinbaren
unterstellen,Ich unterstelle das ja,Ich unterstellte das ja,Ich werde das ja unterstellen,Ich würde das ja unterstellen
punkten,Die Notizfunktionen punkten ebenfalls für das Nokia,Die Notizfunktionen punkteten ebenfalls für das Nokia,Die Notizfunktionen werden ebenfalls für das Nokia punkten,Die Notizfunktionen würden ebenfalls für das Nokia punkten
zahlen,Er zahlt bloss den physischen Zugriff,Er zahlte bloss den physischen Zugriff,Er wird bloss den physischen Zugriff zahlen,Er würde bloss den physischen Zugriff zahlen
widmen,Jeder der zwölf kommenden Monate widmet sich einem sozialpolitischen Thema,Jeder der zwölf kommenden Monate widmete sich einem sozialpolitischen Thema,Jeder der zwölf kommenden Monate wird sich einem sozialpolitischen Thema widmen,Jeder der zwölf kommenden Monate würde sich einem sozialpolitischen Thema widmen
rechtfertigen,Diese überschaubare Anzahl rechtfertigt normalerweise keine aufwendige Gesetzesänderung,Diese überschaubare Anzahl rechtfertigte normalerweise keine aufwendige Gesetzesänderung,Diese überschaubare Anzahl wird normalerweise keine aufwendige Gesetzesänderung rechtfertigen,Diese überschaubare Anzahl würde normalerweise keine aufwendige Gesetzesänderung rechtfertigen
versehen,Ein Mindestlohn versieht Einkommensschwache mit Kaufkraft,Ein Mindestlohn versorgte Einkommensschwache mit Kaufkraft,Ein Mindestlohn wird Einkommensschwache mit Kaufkraft versorgen,Ein Mindestlohn würde Einkommensschwache mit Kaufkraft versorgen
erheben,Der Nieder-Himalaya erhebt sich nördlich des Siwalik-Gebirgszugs,Der Nieder-Himalaya erhob sich nördlich des Siwalik-Gebirgszugs,Der Nieder-Himalaya wird sich nördlich des Siwalik-Gebirgszugs erheben,Der Nieder-Himalaya würde sich nördlich des Siwalik-Gebirgszugs erheben
begrenzen,Dies begrenzt den Preisdruck,Dies begrenzte den Preisdruck,Dies wird den Preisdruck begrenzen,Dies würde den Preisdruck begrenzen
verschließen,Ein schönes Schmiedeeisengitter verschließt die Nischenöffnung,Ein schönes Schmiedeeisengitter verschloss die Nischenöffnung,Ein schönes Schmiedeeisengitter wird die Nischenöffnung verschließen,Ein schönes Schmiedeeisengitter würde die Nischenöffnung verschließen
fungieren,Der Innenhof fungiert als Zeittor,Der Innenhof fungierte als Zeittor,Der Innenhof wird als Zeittor fungieren,Der Innenhof würde als Zeittor fungieren
versetzen,Die Zusammenkunft der selbsternannten Eliten versetzt Davos in einen Belagerungszustand,Die Zusammenkunft der selbsternannten Eliten versetzte Davos in einen Belagerungszustand,Die Zusammenkunft der selbsternannten Eliten wird Davos in einen Belagerungszustand versetzen,Die Zusammenkunft der selbsternannten Eliten würde Davos in einen Belagerungszustand versetzen
verbinden,Was verbindet die beiden?,Was verband die beiden?,Was wird die beiden verbinden?,Was würde die beiden verbinden?
offenbaren,Der Blick in die angrenzende Prototypenhalle offenbart weitere Highlights des Museums,Der Blick in die angrenzende Prototypenhalle offenbarte weitere Highlights des Museums,Der Blick in die angrenzende Prototypenhalle wird weitere Highlights des Museums offenbaren,Der Blick in die angrenzende Prototypenhalle würde weitere Highlights des Museums offenbaren
ausreichen,Keine Ahnung ob deine Vorschläge da ausreichen,Keine Ahnung ob deine Vorschläge da ausreichten,Keine Ahnung ob deine Vorschläge da ausreichen werden,Keine Ahnung ob deine Vorschläge da ausreichen würden
weisen,Die vorläufige Auswertung weist in Richtung menschenrechtsorientierte Position,Die vorläufige Auswertung wies in Richtung menschenrechtsorientierte Position,Die vorläufige Auswertung wird in Richtung menschenrechtsorientierte Position weisen,Die vorläufige Auswertung würde in Richtung menschenrechtsorientierte Position weisen
versammeln,Der Rest versammelt sich um den Frühstückstisch,Der Rest versammelte sich um den Frühstückstisch,Der Rest wird sich um den Frühstückstisch versammeln,Der Rest würde sich um den Frühstückstisch versammeln
werfen,Sie werfen mit Pflastersteinen auf Polizisten,Sie warfen mit Pflastersteinen auf Polizisten,Sie werden mit Pflastersteinen auf Polizisten werfen,Sie würden mit Pflastersteinen auf Polizisten werfen
beeinflussen,Unsere Ahnen beeinflussen uns positiv und negativ,Unsere Ahnen beeinflussten uns positiv und negativ,Unsere Ahnen werden uns positiv und negativ beeinflussen,Unsere Ahnen würden uns positiv und negativ beeinflussen
ansprechen,Das anspricht nicht seiner Taktik,Das ansprach nicht seiner Taktik,Das wird nicht seiner Taktik ansprechen,Das würde nicht seiner Taktik ansprechen
interpretieren,Eine neue Übersetzung von Chao-Hsui Chen interpretiert diese Zeilen,Eine neue Übersetzung von Chao-Hsui Chen interpretierte diese Zeilen,Eine neue Übersetzung von Chao-Hsui Chen wird diese Zeilen interpretieren,Eine neue Übersetzung von Chao-Hsui Chen würde diese Zeilen interpretieren
meistern,Alle anderen Piloten meistern die Aufgaben,Alle anderen Piloten meisterten die Aufgaben,Alle anderen Piloten werden die Aufgaben meistern,Alle anderen Piloten würden die Aufgaben meistern
erfassen,Diese Leute erfassen wir über die Ausländervereine,Diese Leute erfassten wir über die Ausländervereine,Diese Leute werden wir über die Ausländervereine erfassen,Diese Leute würden wir über die Ausländervereine erfassen
tanzen,Alle Paare der Formation tanzen zurzeit im Silberkurs,Alle Paare der Formation tanzten zurzeit im Silberkurs,Alle Paare der Formation werden zurzeit im Silberkurs tanzen,Alle Paare der Formation würden zurzeit im Silberkurs tanzen
jagen,Ein Gig jagt den anderen,Ein Gig jagte den anderen,Ein Gig wird den anderen jagen,Ein Gig würde den anderen jagen
hauen,Man haut sie in die Pfanne,Man haute sie in die Pfanne,Man wird sie in die Pfanne hauen,Man würde sie in die Pfanne hauen
verlieben,Er verliebt sich in sie,Er verliebte sich in sie,Er wird sich in sie verlieben,Er würde sich in sie verlieben
bauen,Ein Hersteller-Shop in Deutschland baut diesen Anteil weiter aus,Ein Hersteller-Shop in Deutschland baute diesen Anteil weiter aus,Ein Hersteller-Shop in Deutschland wird diesen Anteil weiter ausbauen,Ein Hersteller-Shop in Deutschland würde diesen Anteil weiter ausbauen
prägen,Dieser Gedanke prägt ihre Stücke,Dieser Gedanke prägte ihre Stücke,Dieser Gedanke wird ihre Stücke prägen,Dieser Gedanke würde ihre Stücke prägen
profitieren,Sie profitieren,Sie profitierten,Sie werden profitieren,Sie würden profitieren
verpassen,Man verpasst nichts,Man verpasste nichts,Man wird nichts verpassen,Man würde nichts verpassen
eignen,Das Geschenkabo eignet sich zum Verschenken,Das Geschenkabo eignete sich zum Verschenken,Das Geschenkabo wird sich zum Verschenken eignen,Das Geschenkabo würde sich zum Verschenken eignen
integrieren,Es integriert auch die im GeoMIS,Es integrierte auch die im GeoMIS,Es wird auch die im GeoMIS integrieren,Es würde auch die im GeoMIS integrieren
erlassen,Der Gerichtshof erläßt seine Verfahrensordnung,Der Gerichtshof erließ seine Verfahrensordnung,Der Gerichtshof wird seine Verfahrensordnung erlassen,Der Gerichtshof würde seine Verfahrensordnung erlassen
sitzen,Ein Rabbiner und ein katholischer Priester sitzen bei einem Festessen nebeneinander,Ein Rabbiner und ein katholischer Priester saßen bei einem Festessen nebeneinander,Ein Rabbiner und ein katholischer Priester werden bei einem Festessen nebeneinander sitzen,Ein Rabbiner und ein katholischer Priester würden bei einem Festessen nebeneinander sitzen
beruhen,Das Abscheidekonzept beruht auf der Trägheitsabscheidung,Das Abscheidekonzept beruhte auf der Trägheitsabscheidung,Das Abscheidekonzept wird auf der Trägheitsabscheidung beruhen,Das Abscheidekonzept würde auf der Trägheitsabscheidung beruhen
begegnen,Ein secretary-bird begegnet uns als erstes,Ein secretary-bird begegnete uns als erstes,Ein secretary-bird wird uns als erstes begegnen,Ein secretary-bird würde uns als erstes begegnen
bekennen,Der Heimatverein Egestorf eV bekennt sich zum Datenschutz,Der Heimatverein Egestorf eV bekannte sich zum Datenschutz,Der Heimatverein Egestorf eV wird sich zum Datenschutz bekennen,Der Heimatverein Egestorf eV würde sich zum Datenschutz bekennen
besiegen,Die reine Wahrheit besiegt die Lüge,Die reine Wahrheit besiegte die Lüge,Die reine Wahrheit wird die Lüge besiegen,Die reine Wahrheit würde die Lüge besiegen
verlangen,Alle diese Maßnahmen verlangen von uns Geduld,Alle diese Maßnahmen verlangten von uns Geduld,Alle diese Maßnahmen werden von uns Geduld verlangen,Alle diese Maßnahmen würden von uns Geduld verlangen
gucken,Meine Holde guckt schon böse,Meine Holde guckte schon böse,Meine Holde wird schon böse gucken,Meine Holde würde schon böse gucken
kommentieren,Ich kommentiere sie regungslos,Ich kommentierte sie regungslos,Ich werde sie regungslos kommentieren,Ich würde sie regungslos kommentieren
spezialisieren,Viele Kunststoffverarbeiter spezialisieren sich auf einzelne Abnehmerbranchen,Viele Kunststoffverarbeiter spezialisierten sich auf einzelne Abnehmerbranchen,Viele Kunststoffverarbeiter werden sich auf einzelne Abnehmerbranchen spezialisieren,Viele Kunststoffverarbeiter würden sich auf einzelne Abnehmerbranchen spezialisieren
erwähnen,Kein hebräisches Werk dieser Zeit erwähnt eine Golemerschaffung durch Löw,Kein hebräisches Werk dieser Zeit erwähnte eine Golemerschaffung durch Löw,Kein hebräisches Werk dieser Zeit wird eine Golemerschaffung durch Löw erwähnen,Kein hebräisches Werk dieser Zeit würde eine Golemerschaffung durch Löw erwähnen
